{
  "industry": "ipc",
  "industry_zh": "IPC（工业计算机·Industrial PC）",
  "version": "1.2.0",
  "last_updated": "2026-07-02-upstream-downstream-expansion",
  "source_pyramid": {
    "L1": {
      "weight": 3,
      "description": "一手源：厂商官方/行业标准组织/政府机构",
      "entries": [
        {
          "id": "advantech",
          "name_zh": "研华",
          "name_en": "Advantech",
          "type": "competitor",
          "tier": "global_top",
          "domain": "advantech.com",
          "homepage": "https://www.advantech.com",
          "core_expos": [
            "embedded-world",
            "computex"
          ],
          "cross_verify_required": false,
          "domains": [
            "advantech.com",
            "advantech.com.cn",
            "advantech.com.tw"
          ],
          "social_media": {
            "wechat": "研华智能地球",
            "bilibili": "研华Advantech",
            "douyin": "研华Advantech",
            "zhihu": "研华智能地球"
          },
          "verification": {
            "last_verified": "2026-07-02",
            "verified_by": "manual",
            "status": "active",
            "credentials": [],
            "notes": "P0 upgrade 2026-07-02"
          },
          "parent_entity": "Advantech",
          "content_type": "official_announcement",
          "aliases": [
            "研华",
            "Advantech Co., Ltd.",
            "研华科技"
          ],
          "ttl": {
            "valid_until": "permanent",
            "update_frequency": "daily"
          },
          "compliance": {
            "allow_scrape": true,
            "api_available": false,
            "rate_limit": "10/min",
            "robots_txt_compliant": true,
            "data_retention_days": 90,
            "requires_auth": false,
            "jurisdiction": "US"
          }
        },
        {
          "id": "beckhoff",
          "name_zh": "倍福",
          "name_en": "Beckhoff",
          "type": "competitor",
          "tier": "global_top",
          "domain": "beckhoff.com",
          "homepage": "https://www.beckhoff.com",
          "core_expos": [
            "embedded-world",
            "hannover-messe"
          ],
          "cross_verify_required": false,
          "domains": [
            "beckhoff.com",
            "beckhoff.com.cn"
          ],
          "social_media": {
            "wechat": "德国倍福自动化",
            "bilibili": "倍福Beckhoff",
            "douyin": "",
            "zhihu": "倍福Beckhoff"
          },
          "verification": {
            "last_verified": "2026-07-02",
            "verified_by": "manual",
            "status": "active",
            "credentials": [],
            "notes": "P0 upgrade 2026-07-02"
          },
          "parent_entity": "Beckhoff",
          "content_type": "official_announcement",
          "aliases": [
            "倍福",
            "Beckhoff Automation",
            "倍福自动化"
          ],
          "ttl": {
            "valid_until": "permanent",
            "update_frequency": "daily"
          },
          "compliance": {
            "allow_scrape": true,
            "api_available": false,
            "rate_limit": "10/min",
            "robots_txt_compliant": true,
            "data_retention_days": 90,
            "requires_auth": false,
            "jurisdiction": "US"
          }
        },
        {
          "id": "siemens",
          "name_zh": "西门子",
          "name_en": "Siemens",
          "type": "competitor",
          "tier": "global_top",
          "domain": "siemens.com",
          "homepage": "https://www.siemens.com",
          "core_expos": [
            "hannover-messe",
            "sps"
          ],
          "cross_verify_required": false,
          "domains": [
            "siemens.com",
            "siemens.com.cn"
          ],
          "social_media": {
            "wechat": "西门子中国",
            "douyin": "西门子",
            "zhihu": ""
          },
          "verification": {
            "last_verified": "2026-07-02",
            "verified_by": "manual",
            "status": "active",
            "credentials": [],
            "notes": "P0 upgrade 2026-07-02"
          },
          "parent_entity": "Siemens",
          "content_type": "official_announcement",
          "aliases": [
            "西门子",
            "Siemens AG",
            "西门子工业"
          ],
          "ttl": {
            "valid_until": "permanent",
            "update_frequency": "daily"
          },
          "compliance": {
            "allow_scrape": true,
            "api_available": false,
            "rate_limit": "10/min",
            "robots_txt_compliant": true,
            "data_retention_days": 90,
            "requires_auth": false,
            "jurisdiction": "US"
          }
        },
        {
          "id": "adlink",
          "name_zh": "凌华",
          "name_en": "ADLINK",
          "type": "competitor",
          "tier": "regional_top",
          "domain": "adlinktech.com",
          "homepage": "https://www.adlinktech.com",
          "core_expos": [
            "embedded-world",
            "computex"
          ],
          "cross_verify_required": false,
          "domains": [
            "adlinktech.com",
            "adlinktech.com.cn"
          ],
          "social_media": {
            "wechat": "凌华科技",
            "zhihu": ""
          },
          "verification": {
            "last_verified": "2026-07-02",
            "verified_by": "manual",
            "status": "active",
            "credentials": [],
            "notes": "P0 upgrade 2026-07-02"
          },
          "parent_entity": "ADLINK",
          "content_type": "official_announcement",
          "aliases": [
            "凌华",
            "ADLINK Technology",
            "凌华科技"
          ],
          "ttl": {
            "valid_until": "permanent",
            "update_frequency": "daily"
          },
          "compliance": {
            "allow_scrape": true,
            "api_available": false,
            "rate_limit": "10/min",
            "robots_txt_compliant": true,
            "data_retention_days": 90,
            "requires_auth": false,
            "jurisdiction": "US"
          }
        },
        {
          "id": "dfi",
          "name_zh": "友通",
          "name_en": "DFI",
          "type": "competitor",
          "tier": "regional_top",
          "domain": "dfi.com",
          "homepage": "https://www.dfi.com",
          "core_expos": [
            "embedded-world",
            "automate"
          ],
          "cross_verify_required": false,
          "domains": [
            "dfi.com"
          ],
          "social_media": {
            "wechat": "友通资讯DFI"
          },
          "verification": {
            "last_verified": "2026-07-02",
            "verified_by": "manual",
            "status": "active",
            "credentials": [],
            "notes": "P0 upgrade 2026-07-02"
          },
          "parent_entity": "DFI",
          "content_type": "official_announcement",
          "aliases": [
            "友通",
            "DFI Inc.",
            "友通资讯"
          ],
          "ttl": {
            "valid_until": "permanent",
            "update_frequency": "daily"
          },
          "compliance": {
            "allow_scrape": true,
            "api_available": false,
            "rate_limit": "10/min",
            "robots_txt_compliant": true,
            "data_retention_days": 90,
            "requires_auth": false,
            "jurisdiction": "US"
          }
        },
        {
          "id": "aaeon",
          "name_zh": "研扬",
          "name_en": "AAEON",
          "type": "competitor",
          "tier": "regional_top",
          "domain": "aaeon.com",
          "homepage": "https://www.aaeon.com",
          "core_expos": [
            "embedded-world",
            "computex"
          ],
          "cross_verify_required": false,
          "domains": [
            "aaeon.com"
          ],
          "social_media": {
            "wechat": "研扬科技AAEON"
          },
          "verification": {
            "last_verified": "2026-07-02",
            "verified_by": "manual",
            "status": "active",
            "credentials": [],
            "notes": "P0 upgrade 2026-07-02"
          },
          "parent_entity": "ASUSTeK Computer",
          "content_type": "official_announcement",
          "aliases": [
            "研扬",
            "AAEON Technology",
            "研扬科技"
          ],
          "ttl": {
            "valid_until": "permanent",
            "update_frequency": "daily"
          },
          "compliance": {
            "allow_scrape": true,
            "api_available": false,
            "rate_limit": "10/min",
            "robots_txt_compliant": true,
            "data_retention_days": 90,
            "requires_auth": false,
            "jurisdiction": "US"
          }
        },
        {
          "id": "kontron",
          "name_zh": "控创",
          "name_en": "Kontron",
          "type": "competitor",
          "tier": "global_top",
          "domain": "kontron.com",
          "homepage": "https://www.kontron.com",
          "core_expos": [
            "embedded-world"
          ],
          "cross_verify_required": false,
          "domains": [
            "kontron.com"
          ],
          "social_media": {
            "wechat": ""
          },
          "verification": {
            "last_verified": "2026-07-02",
            "verified_by": "manual",
            "status": "active",
            "credentials": [],
            "notes": "P0 upgrade 2026-07-02"
          },
          "parent_entity": "Kontron",
          "content_type": "official_announcement",
          "aliases": [
            "控创",
            "Kontron AG",
            "控创科技"
          ],
          "ttl": {
            "valid_until": "permanent",
            "update_frequency": "daily"
          },
          "compliance": {
            "allow_scrape": true,
            "api_available": false,
            "rate_limit": "10/min",